<?xml version="1.0"?>
<!DOCTYPE Report
[
<!ELEMENT Report (General ,(Doc|BPT)) >
<!ATTLIST Report ver CDATA #REQUIRED tmZone CDATA #REQUIRED>

<!ELEMENT General ( DocLocation ) >
<!ATTLIST General productName CDATA #REQUIRED productVer CDATA #REQUIRED os CDATA #REQUIRED host CDATA #REQUIRED qcserver CDATA #IMPLIED qcproject CDATA #IMPLIED SolManSolutionId CDATA #IMPLIED SolManProjectId CDATA #IMPLIED SolManTestPlanId CDATA #IMPLIED SolManTestPackageId CDATA #IMPLIED SolManUserInfoData CDATA #IMPLIED  >

<!ELEMENT BPT (DName,Res,DVer?,TSet?,TInst?,NodeArgs,AdditionalInfo*,Doc*) >
<!ATTLIST BPT rID ID #REQUIRED >

<!ELEMENT Doc (DName,ConfName?,Res,DVer?,TSet?,TInst?,RunType?,DT?,AdditionalInfo*,Step*,DIter*,Step*,Action*,Doc*,Summary?,TestMaintenanceSummary*,NodeArgs?) >
<!ATTLIST Doc rID ID #REQUIRED type (Test|BC|BPTWrapperTest|Flow|Group|Action) "Test" productName CDATA #REQUIRED BCIter CDATA #IMPLIED >

<!ELEMENT RunType ( #PCDATA )>
<!ATTLIST RunType fmStep (False|True) "False" batch (False|True) "False" upDesc (False|True) "False" upChk (False|True) "False" upAS (False|True) "False">

<!ELEMENT DName ( #PCDATA ) >

<!ELEMENT ConfName ( #PCDATA ) >

<!ELEMENT Res ( #PCDATA ) >

<!ELEMENT AdditionalInfo (AdditionalDataName,AdditionalDataValue ) >

<!ELEMENT AdditionalDataName ( #PCDATA ) >

<!ELEMENT AdditionalDataValue ( #PCDATA ) >

<!ELEMENT DVer ( #PCDATA ) >

<!ELEMENT TSet ( #PCDATA ) >

<!ELEMENT TInst ( #PCDATA ) >

<!ELEMENT DIter (Step*,Action+,Summary?,NodeArgs)>
<!ATTLIST DIter rID ID #REQUIRED iterID CDATA #REQUIRED>

<!ELEMENT DocLocation ( #PCDATA )>

<!ELEMENT Action (AName,AIter*,(Step|HtmlStep|Action)*, Summary,ActionMaintenanceSummary*, NodeArgs ) >
<!ATTLIST Action rID ID #REQUIRED>

<!ELEMENT AIter ((Step|HtmlStep|Action)*,DataMapping?, Summary?,NodeArgs) >
<!ATTLIST AIter rID ID #REQUIRED iterID CDATA #REQUIRED isCountable (False|True) "False" >

<!ELEMENT AName ( #PCDATA ) >

<!ELEMENT TestMaintenanceSummary (ActionMaintenanceSummary*) >
<!ATTLIST TestMaintenanceSummary ObjectsAdded CDATA #REQUIRED ObjectsUpdated CDATA #REQUIRED StepsUpdated CDATA #REQUIRED StepsComments CDATA #REQUIRED><!ELEMENT ActionMaintenanceSummary (ObjectChange* ) >
<!ATTLIST ActionMaintenanceSummary Action CDATA #REQUIRED Objects CDATA #REQUIRED Updated CDATA #REQUIRED LinesTotal CDATA #REQUIRED Added CDATA #REQUIRED LinesUpdated CDATA #REQUIRED>

<!ELEMENT ObjectChange  (Hierarchy, PropertyChangeList* ) >
<!ATTLIST ObjectChange Operation CDATA #IMPLIED OriginalRepository CDATA #IMPLIED>

<!ELEMENT PropertyChangeList (PropertyDef*) >

<!ELEMENT PropertyDef (OriginalValue, NewValue) >
<!ATTLIST PropertyDef PropName CDATA #REQUIRED OriginRegularExpression (True|False) "False" NewRegularExpression (True|False) "False" AddedProperty (True|False) "False" >

<!ELEMENT OriginalValue ( #PCDATA )>

<!ELEMENT NewValue ( #PCDATA )>

<!ELEMENT Hierarchy  (ObjectName, Hierarchy*) >
<!ATTLIST Hierarchy MicClass CDATA #REQUIRED>

<!ELEMENT ObjectName  ( #PCDATA ) >

<!ELEMENT Step (Obj,Details,Time,TimeTick* ,(Step|HtmlStep|Doc)*, DataMapping?, NodeArgs) >
<!ATTLIST Step rID ID #REQUIRED retval CDATA #IMPLIED>

<!ELEMENT HtmlStep (HTML,TimeTick*,(Step|HtmlStep|Doc)*,NodeArgs) >
<!ATTLIST HtmlStep rID ID #REQUIRED >

<!ELEMENT Obj ( #PCDATA ) >
<!ATTLIST Obj plainTxt (False|True) "True">

<!ELEMENT Details ( #PCDATA ) >
<!ATTLIST Details plainTxt (False|True) "True">

<!ELEMENT Time ( #PCDATA ) >

<!ELEMENT HTML ( #PCDATA ) >

<!ELEMENT Disp ( #PCDATA ) >

<!ELEMENT TimeTick ( #PCDATA ) >

<!ELEMENT DataMapping ( DataMappedItem* )>
<!ELEMENT DataMappedItem EMPTY >
<!ATTLIST DataMappedItem dsName CDATA #REQUIRED >
<!ATTLIST DataMappedItem rowId CDATA #REQUIRED >

<!ELEMENT NodeArgs (Disp,TopPane?,BtmPane?,ExtendedInfo? )>
<!ATTLIST NodeArgs eType CDATA #REQUIRED icon CDATA #REQUIRED nRep CDATA #REQUIRED UserNote CDATA #IMPLIED filter (False|True) "True">
<!ATTLIST NodeArgs status (Passed|Failed|Done|Warning|Information) "Done">
<!ATTLIST NodeArgs iconSel CDATA #IMPLIED nType CDATA #IMPLIED MovieMarker CDATA "">
<!ATTLIST NodeArgs Source CDATA #IMPLIED SourceLine CDATA #IMPLIED StepFlowItemKey CDATA #IMPLIED >

<!ELEMENT TopPane (Path)>

<!ELEMENT BtmPane ( (Path|WR)?,ASHilite?)>
<!ATTLIST BtmPane vType CDATA "HTML">

<!ELEMENT Path ( #PCDATA ) >

<!ELEMENT ASHilite ( #PCDATA ) >

<!ELEMENT WR ( #PCDATA ) >

<!ELEMENT ExtendedInfo ( StepData ) >

<!ATTLIST ExtendedInfo StepType CDATA #REQUIRED>
<!ELEMENT DT (NodeArgs) >
<!ATTLIST DT rID ID #REQUIRED>

<!ELEMENT Summary (Param*)>
<!ATTLIST Summary sTime CDATA #IMPLIED eTime CDATA #IMPLIED passed CDATA #IMPLIED failed CDATA #IMPLIED warnings CDATA #IMPLIED retval CDATA #IMPLIED stopped (False|True) "False" >

<!ELEMENT Param (ParamName,ParamVal)+ >
<!ATTLIST Param paramInOut (In|Out) "In">

<!ELEMENT ParamName ( #PCDATA ) >

<!ELEMENT ParamVal ( #PCDATA ) >

]
>
<Report ver="2.0" tmZone="GMT Standard Time">
<General productName="Micro Focus Unified Functional Testing" productVer="15.0.2" os="" host="AO2E2E919R4"><DocLocation><![CDATA[C:\OnStack_InStoreSales\Automation\TestScripts\TC091_NC_Accessories]]></DocLocation></General>
<Doc rID="T1"   productName= "Micro Focus Unified Functional Testing"  >
<DName><![CDATA[TC091_NC_Accessories]]></DName>
<Res><![CDATA[Res16]]></Res>
<DT rID="T2">
<NodeArgs eType="Table" icon="2" nRep="4" filter="False" >
<Disp><![CDATA[Run-Time Data Table]]></Disp>
<BtmPane vType="Table" >
<Path><![CDATA[Default.xlsx]]></Path>
</BtmPane>
</NodeArgs>
</DT>
<DIter rID="T3" iterID="1" >
<Action rID="T4">
<AName><![CDATA[Action1]]></AName>
<Step rID="T5">
<Obj plainTxt="False" ><![CDATA[LoadFunctionLibrary]]></Obj>
<Details plainTxt="False" ><![CDATA[LoadFunctionLibrary function passed]]></Details>
<Time><![CDATA[5/11/2021 - 15:12:36]]></Time>
<TimeTick>1620742356</TimeTick>
<NodeArgs eType="Replay" icon="5" nRep="8" status="Passed" Source="Action1" SourceLine="70" >
<Disp><![CDATA[LoadFunctionLibrary]]></Disp>
</NodeArgs>
</Step>
<Step rID="T6">
<Obj plainTxt="False" ><![CDATA[LoadFunctionLibrary]]></Obj>
<Details plainTxt="False" ><![CDATA[The following function libraries either could not be found in the specified paths or the paths were not valid: C:\OnStack_InStoreSales\Automation\FunctionLibrary\Evolution.qfl]]></Details>
<Time><![CDATA[5/11/2021 - 15:12:36]]></Time>
<TimeTick>1620742356</TimeTick>
<NodeArgs eType="Replay" icon="5" nRep="9" status="Failed" Source="Action1" SourceLine="71" >
<Disp><![CDATA[LoadFunctionLibrary]]></Disp>
</NodeArgs>
</Step>
<Step rID="T7">
<Obj plainTxt="False" ><![CDATA[LoadFunctionLibrary]]></Obj>
<Details plainTxt="False" ><![CDATA[LoadFunctionLibrary function passed]]></Details>
<Time><![CDATA[5/11/2021 - 15:12:36]]></Time>
<TimeTick>1620742356</TimeTick>
<NodeArgs eType="Replay" icon="5" nRep="10" status="Passed" Source="Action1" SourceLine="72" >
<Disp><![CDATA[LoadFunctionLibrary]]></Disp>
</NodeArgs>
</Step>
<Step rID="T8">
<Obj plainTxt="False" ><![CDATA[Oracle Retail Xstore Point]]></Obj>
<Details plainTxt="False" ><![CDATA[JavaWindow]]></Details>
<Time><![CDATA[5/11/2021 - 15:12:36]]></Time>
<TimeTick>1620742356</TimeTick>
<Step rID="T9">
<Obj plainTxt="False" ><![CDATA[Back Office.Exist]]></Obj>
<Details plainTxt="False" ><![CDATA["Object exists"]]></Details>
<Time><![CDATA[5/11/2021 - 15:12:36]]></Time>
<TimeTick>1620742356</TimeTick>
<NodeArgs eType="Replay" icon="7" nRep="12" >
<Disp><![CDATA[Back Office.Exist]]></Disp>
</NodeArgs>
</Step>
<Step rID="T10">
<Obj plainTxt="False" ><![CDATA[Back Office.Click]]></Obj>
<Details plainTxt="False" ><![CDATA["LEFT"]]></Details>
<Time><![CDATA[5/11/2021 - 15:12:36]]></Time>
<TimeTick>1620742356</TimeTick>
<NodeArgs eType="Replay" icon="7" nRep="14" >
<Disp><![CDATA[Back Office.Click]]></Disp>
</NodeArgs>
</Step>
<Step rID="T11">
<Obj plainTxt="False" ><![CDATA[Back Office Login.Set]]></Obj>
<Details plainTxt="False" ><![CDATA["100"]]></Details>
<Time><![CDATA[5/11/2021 - 15:12:37]]></Time>
<TimeTick>1620742357</TimeTick>
<NodeArgs eType="Replay" icon="8" nRep="16" >
<Disp><![CDATA[Back Office Login.Set]]></Disp>
</NodeArgs>
</Step>
<Step rID="T12">
<Obj plainTxt="False" ><![CDATA[Back Office Login.Activate]]></Obj>
<Details plainTxt="False" ><![CDATA[]]></Details>
<Time><![CDATA[5/11/2021 - 15:12:37]]></Time>
<TimeTick>1620742357</TimeTick>
<NodeArgs eType="Replay" icon="8" nRep="18" >
<Disp><![CDATA[Back Office Login.Activate]]></Disp>
</NodeArgs>
</Step>
<Step rID="T13">
<Obj plainTxt="False" ><![CDATA[Back Office Login.Set]]></Obj>
<Details plainTxt="False" ><![CDATA["1234"]]></Details>
<Time><![CDATA[5/11/2021 - 15:12:37]]></Time>
<TimeTick>1620742357</TimeTick>
<NodeArgs eType="Replay" icon="8" nRep="20" >
<Disp><![CDATA[Back Office Login.Set]]></Disp>
</NodeArgs>
</Step>
<Step rID="T14">
<Obj plainTxt="False" ><![CDATA[Back Office Login.Activate]]></Obj>
<Details plainTxt="False" ><![CDATA[]]></Details>
<Time><![CDATA[5/11/2021 - 15:12:37]]></Time>
<TimeTick>1620742357</TimeTick>
<NodeArgs eType="Replay" icon="8" nRep="22" >
<Disp><![CDATA[Back Office Login.Activate]]></Disp>
</NodeArgs>
</Step>
<Step rID="T15">
<Obj plainTxt="False" ><![CDATA[Override.Exist]]></Obj>
<Details plainTxt="False" ><![CDATA["Object exists"]]></Details>
<Time><![CDATA[5/11/2021 - 15:12:38]]></Time>
<TimeTick>1620742358</TimeTick>
<NodeArgs eType="Replay" icon="7" nRep="23" >
<Disp><![CDATA[Override.Exist]]></Disp>
</NodeArgs>
</Step>
<Step rID="T16">
<Obj plainTxt="False" ><![CDATA[Override.Click]]></Obj>
<Details plainTxt="False" ><![CDATA["LEFT"]]></Details>
<Time><![CDATA[5/11/2021 - 15:12:38]]></Time>
<TimeTick>1620742358</TimeTick>
<NodeArgs eType="Replay" icon="7" nRep="25" >
<Disp><![CDATA[Override.Click]]></Disp>
</NodeArgs>
</Step>
<Step rID="T17">
<Obj plainTxt="False" ><![CDATA[Yes.Click]]></Obj>
<Details plainTxt="False" ><![CDATA["LEFT"]]></Details>
<Time><![CDATA[5/11/2021 - 15:12:40]]></Time>
<TimeTick>1620742360</TimeTick>
<NodeArgs eType="Replay" icon="7" nRep="27" >
<Disp><![CDATA[Yes.Click]]></Disp>
</NodeArgs>
</Step>
<Step rID="T18">
<Obj plainTxt="False" ><![CDATA[Confirm.Click]]></Obj>
<Details plainTxt="False" ><![CDATA["LEFT"]]></Details>
<Time><![CDATA[5/11/2021 - 15:12:42]]></Time>
<TimeTick>1620742362</TimeTick>
<NodeArgs eType="Replay" icon="7" nRep="29" >
<Disp><![CDATA[Confirm.Click]]></Disp>
</NodeArgs>
</Step>
<Step rID="T19">
<Obj plainTxt="False" ><![CDATA[DtvList.Select]]></Obj>
<Details plainTxt="False" ><![CDATA["#2"]]></Details>
<Time><![CDATA[5/11/2021 - 15:12:46]]></Time>
<TimeTick>1620742366</TimeTick>
<NodeArgs eType="Replay" icon="9" nRep="31" >
<Disp><![CDATA[DtvList.Select]]></Disp>
</NodeArgs>
</Step>
<Step rID="T20">
<Obj plainTxt="False" ><![CDATA[DtvList.Select]]></Obj>
<Details plainTxt="False" ><![CDATA["#6"]]></Details>
<Time><![CDATA[5/11/2021 - 15:12:48]]></Time>
<TimeTick>1620742368</TimeTick>
<NodeArgs eType="Replay" icon="9" nRep="33" >
<Disp><![CDATA[DtvList.Select]]></Disp>
</NodeArgs>
</Step>
<Step rID="T21">
<Obj plainTxt="False" ><![CDATA[Adjustment Type.Select]]></Obj>
<Details plainTxt="False" ><![CDATA["Sellable"]]></Details>
<Time><![CDATA[5/11/2021 - 15:12:50]]></Time>
<TimeTick>1620742370</TimeTick>
<NodeArgs eType="Replay" icon="9" nRep="35" >
<Disp><![CDATA[Adjustment Type.Select]]></Disp>
</NodeArgs>
</Step>
<Step rID="T22">
<Obj plainTxt="False" ><![CDATA[Reason.Select]]></Obj>
<Details plainTxt="False" ><![CDATA["ASSUMED THEFT"]]></Details>
<Time><![CDATA[5/11/2021 - 15:12:52]]></Time>
<TimeTick>1620742372</TimeTick>
<NodeArgs eType="Replay" icon="9" nRep="37" >
<Disp><![CDATA[Reason.Select]]></Disp>
</NodeArgs>
</Step>
<Step rID="T23">
<Obj plainTxt="False" ><![CDATA[Justification.Set]]></Obj>
<Details plainTxt="False" ><![CDATA["test"]]></Details>
<Time><![CDATA[5/11/2021 - 15:12:54]]></Time>
<TimeTick>1620742374</TimeTick>
<NodeArgs eType="Replay" icon="8" nRep="39" >
<Disp><![CDATA[Justification.Set]]></Disp>
</NodeArgs>
</Step>
<Step rID="T24">
<Obj plainTxt="False" ><![CDATA[Enter PLU.Set]]></Obj>
<Details plainTxt="False" ><![CDATA["0190198763105"]]></Details>
<Time><![CDATA[5/11/2021 - 15:12:58]]></Time>
<TimeTick>1620742378</TimeTick>
<NodeArgs eType="Replay" icon="8" nRep="41" >
<Disp><![CDATA[Enter PLU.Set]]></Disp>
</NodeArgs>
</Step>
<Step rID="T25">
<Obj plainTxt="False" ><![CDATA[Enter PLU.Activate]]></Obj>
<Details plainTxt="False" ><![CDATA[]]></Details>
<Time><![CDATA[5/11/2021 - 15:12:58]]></Time>
<TimeTick>1620742378</TimeTick>
<NodeArgs eType="Replay" icon="8" nRep="43" >
<Disp><![CDATA[Enter PLU.Activate]]></Disp>
</NodeArgs>
</Step>
<Step rID="T26">
<Obj plainTxt="False" ><![CDATA[Enter Quantity.Set]]></Obj>
<Details plainTxt="False" ><![CDATA["1"]]></Details>
<Time><![CDATA[5/11/2021 - 15:13:00]]></Time>
<TimeTick>1620742380</TimeTick>
<NodeArgs eType="Replay" icon="8" nRep="45" >
<Disp><![CDATA[Enter Quantity.Set]]></Disp>
</NodeArgs>
</Step>
<Step rID="T27">
<Obj plainTxt="False" ><![CDATA[Enter Quantity.Activate]]></Obj>
<Details plainTxt="False" ><![CDATA[]]></Details>
<Time><![CDATA[5/11/2021 - 15:13:00]]></Time>
<TimeTick>1620742380</TimeTick>
<NodeArgs eType="Replay" icon="8" nRep="47" >
<Disp><![CDATA[Enter Quantity.Activate]]></Disp>
</NodeArgs>
</Step>
<Step rID="T28">
<Obj plainTxt="False" ><![CDATA[Confirm.Exist]]></Obj>
<Details plainTxt="False" ><![CDATA["Object exists"]]></Details>
<Time><![CDATA[5/11/2021 - 15:13:03]]></Time>
<TimeTick>1620742383</TimeTick>
<NodeArgs eType="Replay" icon="7" nRep="48" >
<Disp><![CDATA[Confirm.Exist]]></Disp>
</NodeArgs>
</Step>
<Step rID="T29">
<Obj plainTxt="False" ><![CDATA[Confirm.Click]]></Obj>
<Details plainTxt="False" ><![CDATA["LEFT"]]></Details>
<Time><![CDATA[5/11/2021 - 15:13:03]]></Time>
<TimeTick>1620742383</TimeTick>
<NodeArgs eType="Replay" icon="7" nRep="50" >
<Disp><![CDATA[Confirm.Click]]></Disp>
</NodeArgs>
</Step>
<Step rID="T30">
<Obj plainTxt="False" ><![CDATA[Back.Exist]]></Obj>
<Details plainTxt="False" ><![CDATA["Object exists"]]></Details>
<Time><![CDATA[5/11/2021 - 15:13:06]]></Time>
<TimeTick>1620742386</TimeTick>
<NodeArgs eType="Replay" icon="7" nRep="51" >
<Disp><![CDATA[Back.Exist]]></Disp>
</NodeArgs>
</Step>
<NodeArgs eType="Context" icon="6" nRep="11" >
<Disp><![CDATA[Oracle Retail Xstore Point]]></Disp>
</NodeArgs>
</Step>
<Step rID="T31">
<Obj ><![CDATA[Stock adjustment added for  PLU]]></Obj>
<Details ><![CDATA[Stock adjustment added for  PLU successfully.]]></Details>
<Time><![CDATA[5/11/2021 - 15:13:06]]></Time>
<TimeTick>1620742386</TimeTick>
<NodeArgs eType="User" icon="10" nRep="52" status="Passed" >
<Disp><![CDATA[Stock adjustment added for  PLU]]></Disp>
</NodeArgs>
</Step>
<Step rID="T32">
<Obj plainTxt="False" ><![CDATA[Oracle Retail Xstore Point]]></Obj>
<Details plainTxt="False" ><![CDATA[JavaWindow]]></Details>
<Time><![CDATA[5/11/2021 - 15:13:08]]></Time>
<TimeTick>1620742388</TimeTick>
<Step rID="T33">
<Obj plainTxt="False" ><![CDATA[Yes.Exist]]></Obj>
<Details plainTxt="False" ><![CDATA["Object does not exist"]]></Details>
<Time><![CDATA[5/11/2021 - 15:13:08]]></Time>
<TimeTick>1620742388</TimeTick>
<NodeArgs eType="Replay" icon="7" nRep="55" >
<Disp><![CDATA[Yes.Exist]]></Disp>
</NodeArgs>
</Step>
<Step rID="T34">
<Obj plainTxt="False" ><![CDATA[[ JavaEdit ].Exist]]></Obj>
<Details plainTxt="False" ><![CDATA["Object does not exist"]]></Details>
<Time><![CDATA[5/11/2021 - 15:13:10]]></Time>
<TimeTick>1620742390</TimeTick>
<NodeArgs eType="Replay" icon="8" nRep="57" >
<Disp><![CDATA[[ JavaEdit ].Exist]]></Disp>
</NodeArgs>
</Step>
<Step rID="T35">
<Obj plainTxt="False" ><![CDATA[Back_2.Exist]]></Obj>
<Details plainTxt="False" ><![CDATA["Object exists"]]></Details>
<Time><![CDATA[5/11/2021 - 15:13:10]]></Time>
<TimeTick>1620742390</TimeTick>
<NodeArgs eType="Replay" icon="7" nRep="58" >
<Disp><![CDATA[Back_2.Exist]]></Disp>
</NodeArgs>
</Step>
<Step rID="T36">
<Obj plainTxt="False" ><![CDATA[Back_2.Click]]></Obj>
<Details plainTxt="False" ><![CDATA["LEFT"]]></Details>
<Time><![CDATA[5/11/2021 - 15:13:10]]></Time>
<TimeTick>1620742390</TimeTick>
<NodeArgs eType="Replay" icon="7" nRep="60" >
<Disp><![CDATA[Back_2.Click]]></Disp>
</NodeArgs>
</Step>
<Step rID="T37">
<Obj plainTxt="False" ><![CDATA[Yes.Exist]]></Obj>
<Details plainTxt="False" ><![CDATA["Object does not exist"]]></Details>
<Time><![CDATA[5/11/2021 - 15:13:12]]></Time>
<TimeTick>1620742392</TimeTick>
<NodeArgs eType="Replay" icon="7" nRep="62" >
<Disp><![CDATA[Yes.Exist]]></Disp>
</NodeArgs>
</Step>
<Step rID="T38">
<Obj plainTxt="False" ><![CDATA[[ JavaEdit ].Exist]]></Obj>
<Details plainTxt="False" ><![CDATA["Object does not exist"]]></Details>
<Time><![CDATA[5/11/2021 - 15:13:13]]></Time>
<TimeTick>1620742393</TimeTick>
<NodeArgs eType="Replay" icon="8" nRep="64" >
<Disp><![CDATA[[ JavaEdit ].Exist]]></Disp>
</NodeArgs>
</Step>
<Step rID="T39">
<Obj plainTxt="False" ><![CDATA[Back_2.Exist]]></Obj>
<Details plainTxt="False" ><![CDATA["Object exists"]]></Details>
<Time><![CDATA[5/11/2021 - 15:13:13]]></Time>
<TimeTick>1620742393</TimeTick>
<NodeArgs eType="Replay" icon="7" nRep="65" >
<Disp><![CDATA[Back_2.Exist]]></Disp>
</NodeArgs>
</Step>
<Step rID="T40">
<Obj plainTxt="False" ><![CDATA[Back_2.Click]]></Obj>
<Details plainTxt="False" ><![CDATA["LEFT"]]></Details>
<Time><![CDATA[5/11/2021 - 15:13:13]]></Time>
<TimeTick>1620742393</TimeTick>
<NodeArgs eType="Replay" icon="7" nRep="67" >
<Disp><![CDATA[Back_2.Click]]></Disp>
</NodeArgs>
</Step>
<Step rID="T41">
<Obj plainTxt="False" ><![CDATA[Yes.Exist]]></Obj>
<Details plainTxt="False" ><![CDATA["Object does not exist"]]></Details>
<Time><![CDATA[5/11/2021 - 15:13:15]]></Time>
<TimeTick>1620742395</TimeTick>
<NodeArgs eType="Replay" icon="7" nRep="69" >
<Disp><![CDATA[Yes.Exist]]></Disp>
</NodeArgs>
</Step>
<Step rID="T42">
<Obj plainTxt="False" ><![CDATA[[ JavaEdit ].Exist]]></Obj>
<Details plainTxt="False" ><![CDATA["Object does not exist"]]></Details>
<Time><![CDATA[5/11/2021 - 15:13:16]]></Time>
<TimeTick>1620742396</TimeTick>
<NodeArgs eType="Replay" icon="8" nRep="71" >
<Disp><![CDATA[[ JavaEdit ].Exist]]></Disp>
</NodeArgs>
</Step>
<Step rID="T43">
<Obj plainTxt="False" ><![CDATA[Back_2.Exist]]></Obj>
<Details plainTxt="False" ><![CDATA["Object exists"]]></Details>
<Time><![CDATA[5/11/2021 - 15:13:16]]></Time>
<TimeTick>1620742396</TimeTick>
<NodeArgs eType="Replay" icon="7" nRep="72" >
<Disp><![CDATA[Back_2.Exist]]></Disp>
</NodeArgs>
</Step>
<NodeArgs eType="Context" icon="6" nRep="54" >
<Disp><![CDATA[Oracle Retail Xstore Point]]></Disp>
</NodeArgs>
</Step>
<Step rID="T44">
<Obj ><![CDATA[Back_2 button not displayed]]></Obj>
<Details ><![CDATA[Button not displayed]]></Details>
<Time><![CDATA[5/11/2021 - 15:13:16]]></Time>
<TimeTick>1620742396</TimeTick>
<NodeArgs eType="User" icon="10" nRep="73" status="Passed" >
<Disp><![CDATA[Back_2 button not displayed]]></Disp>
</NodeArgs>
</Step>
<Step rID="T45">
<Obj plainTxt="False" ><![CDATA[Oracle Retail Xstore Point]]></Obj>
<Details plainTxt="False" ><![CDATA[JavaWindow]]></Details>
<Time><![CDATA[5/11/2021 - 15:13:19]]></Time>
<TimeTick>1620742399</TimeTick>
<Step rID="T46">
<Obj plainTxt="False" ><![CDATA[Yes.Exist]]></Obj>
<Details plainTxt="False" ><![CDATA["Object does not exist"]]></Details>
<Time><![CDATA[5/11/2021 - 15:13:19]]></Time>
<TimeTick>1620742399</TimeTick>
<NodeArgs eType="Replay" icon="7" nRep="76" >
<Disp><![CDATA[Yes.Exist]]></Disp>
</NodeArgs>
</Step>
<Step rID="T47">
<Obj plainTxt="False" ><![CDATA[[ JavaEdit ].Exist]]></Obj>
<Details plainTxt="False" ><![CDATA["Object does not exist"]]></Details>
<Time><![CDATA[5/11/2021 - 15:13:20]]></Time>
<TimeTick>1620742400</TimeTick>
<NodeArgs eType="Replay" icon="8" nRep="78" >
<Disp><![CDATA[[ JavaEdit ].Exist]]></Disp>
</NodeArgs>
</Step>
<Step rID="T48">
<Obj plainTxt="False" ><![CDATA[Back_2.Exist]]></Obj>
<Details plainTxt="False" ><![CDATA["Object exists"]]></Details>
<Time><![CDATA[5/11/2021 - 15:13:20]]></Time>
<TimeTick>1620742400</TimeTick>
<NodeArgs eType="Replay" icon="7" nRep="79" >
<Disp><![CDATA[Back_2.Exist]]></Disp>
</NodeArgs>
</Step>
<NodeArgs eType="Context" icon="6" nRep="75" >
<Disp><![CDATA[Oracle Retail Xstore Point]]></Disp>
</NodeArgs>
</Step>
<Step rID="T49">
<Obj ><![CDATA[Back_2 button not displayed]]></Obj>
<Details ><![CDATA[Button not displayed]]></Details>
<Time><![CDATA[5/11/2021 - 15:13:20]]></Time>
<TimeTick>1620742400</TimeTick>
<NodeArgs eType="User" icon="10" nRep="80" status="Passed" >
<Disp><![CDATA[Back_2 button not displayed]]></Disp>
</NodeArgs>
</Step>
<Step rID="T50">
<Obj plainTxt="False" ><![CDATA[Oracle Retail Xstore Point]]></Obj>
<Details plainTxt="False" ><![CDATA[JavaWindow]]></Details>
<Time><![CDATA[5/11/2021 - 15:13:22]]></Time>
<TimeTick>1620742402</TimeTick>
<Step rID="T51">
<Obj plainTxt="False" ><![CDATA[Yes.Exist]]></Obj>
<Details plainTxt="False" ><![CDATA["Object does not exist"]]></Details>
<Time><![CDATA[5/11/2021 - 15:13:22]]></Time>
<TimeTick>1620742402</TimeTick>
<NodeArgs eType="Replay" icon="7" nRep="83" >
<Disp><![CDATA[Yes.Exist]]></Disp>
</NodeArgs>
</Step>
<Step rID="T52">
<Obj plainTxt="False" ><![CDATA[[ JavaEdit ].Exist]]></Obj>
<Details plainTxt="False" ><![CDATA["Object does not exist"]]></Details>
<Time><![CDATA[5/11/2021 - 15:13:23]]></Time>
<TimeTick>1620742403</TimeTick>
<NodeArgs eType="Replay" icon="8" nRep="85" >
<Disp><![CDATA[[ JavaEdit ].Exist]]></Disp>
</NodeArgs>
</Step>
<Step rID="T53">
<Obj plainTxt="False" ><![CDATA[Back_2.Exist]]></Obj>
<Details plainTxt="False" ><![CDATA["Object exists"]]></Details>
<Time><![CDATA[5/11/2021 - 15:13:23]]></Time>
<TimeTick>1620742403</TimeTick>
<NodeArgs eType="Replay" icon="7" nRep="86" >
<Disp><![CDATA[Back_2.Exist]]></Disp>
</NodeArgs>
</Step>
<NodeArgs eType="Context" icon="6" nRep="82" >
<Disp><![CDATA[Oracle Retail Xstore Point]]></Disp>
</NodeArgs>
</Step>
<Step rID="T54">
<Obj ><![CDATA[Back_2 button not displayed]]></Obj>
<Details ><![CDATA[Button not displayed]]></Details>
<Time><![CDATA[5/11/2021 - 15:13:23]]></Time>
<TimeTick>1620742403</TimeTick>
<NodeArgs eType="User" icon="10" nRep="87" status="Passed" >
<Disp><![CDATA[Back_2 button not displayed]]></Disp>
</NodeArgs>
</Step>
<Step rID="T55">
<Obj plainTxt="False" ><![CDATA[Oracle Retail Xstore Point]]></Obj>
<Details plainTxt="False" ><![CDATA[JavaWindow]]></Details>
<Time><![CDATA[5/11/2021 - 15:13:25]]></Time>
<TimeTick>1620742405</TimeTick>
<Step rID="T56">
<Obj plainTxt="False" ><![CDATA[Yes.Exist]]></Obj>
<Details plainTxt="False" ><![CDATA["Object does not exist"]]></Details>
<Time><![CDATA[5/11/2021 - 15:13:25]]></Time>
<TimeTick>1620742405</TimeTick>
<NodeArgs eType="Replay" icon="7" nRep="90" >
<Disp><![CDATA[Yes.Exist]]></Disp>
</NodeArgs>
</Step>
<Step rID="T57">
<Obj plainTxt="False" ><![CDATA[[ JavaEdit ].Exist]]></Obj>
<Details plainTxt="False" ><![CDATA["Object does not exist"]]></Details>
<Time><![CDATA[5/11/2021 - 15:13:27]]></Time>
<TimeTick>1620742407</TimeTick>
<NodeArgs eType="Replay" icon="8" nRep="92" >
<Disp><![CDATA[[ JavaEdit ].Exist]]></Disp>
</NodeArgs>
</Step>
<Step rID="T58">
<Obj plainTxt="False" ><![CDATA[Back_2.Exist]]></Obj>
<Details plainTxt="False" ><![CDATA["Object exists"]]></Details>
<Time><![CDATA[5/11/2021 - 15:13:27]]></Time>
<TimeTick>1620742407</TimeTick>
<NodeArgs eType="Replay" icon="7" nRep="93" >
<Disp><![CDATA[Back_2.Exist]]></Disp>
</NodeArgs>
</Step>
<NodeArgs eType="Context" icon="6" nRep="89" >
<Disp><![CDATA[Oracle Retail Xstore Point]]></Disp>
</NodeArgs>
</Step>
<Step rID="T59">
<Obj ><![CDATA[Back_2 button not displayed]]></Obj>
<Details ><![CDATA[Button not displayed]]></Details>
<Time><![CDATA[5/11/2021 - 15:13:27]]></Time>
<TimeTick>1620742407</TimeTick>
<NodeArgs eType="User" icon="10" nRep="94" status="Passed" >
<Disp><![CDATA[Back_2 button not displayed]]></Disp>
</NodeArgs>
</Step>
<Step rID="T60">
<Obj plainTxt="False" ><![CDATA[Oracle Retail Xstore Point]]></Obj>
<Details plainTxt="False" ><![CDATA[JavaWindow]]></Details>
<Time><![CDATA[5/11/2021 - 15:13:29]]></Time>
<TimeTick>1620742409</TimeTick>
<Step rID="T61">
<Obj plainTxt="False" ><![CDATA[Yes.Exist]]></Obj>
<Details plainTxt="False" ><![CDATA["Object does not exist"]]></Details>
<Time><![CDATA[5/11/2021 - 15:13:29]]></Time>
<TimeTick>1620742409</TimeTick>
<NodeArgs eType="Replay" icon="7" nRep="97" >
<Disp><![CDATA[Yes.Exist]]></Disp>
</NodeArgs>
</Step>
<Step rID="T62">
<Obj plainTxt="False" ><![CDATA[[ JavaEdit ].Exist]]></Obj>
<Details plainTxt="False" ><![CDATA["Object does not exist"]]></Details>
<Time><![CDATA[5/11/2021 - 15:13:30]]></Time>
<TimeTick>1620742410</TimeTick>
<NodeArgs eType="Replay" icon="8" nRep="99" >
<Disp><![CDATA[[ JavaEdit ].Exist]]></Disp>
</NodeArgs>
</Step>
<Step rID="T63">
<Obj plainTxt="False" ><![CDATA[Back_2.Exist]]></Obj>
<Details plainTxt="False" ><![CDATA["Object exists"]]></Details>
<Time><![CDATA[5/11/2021 - 15:13:30]]></Time>
<TimeTick>1620742410</TimeTick>
<NodeArgs eType="Replay" icon="7" nRep="100" >
<Disp><![CDATA[Back_2.Exist]]></Disp>
</NodeArgs>
</Step>
<NodeArgs eType="Context" icon="6" nRep="96" >
<Disp><![CDATA[Oracle Retail Xstore Point]]></Disp>
</NodeArgs>
</Step>
<Step rID="T64">
<Obj ><![CDATA[Back_2 button not displayed]]></Obj>
<Details ><![CDATA[Button not displayed]]></Details>
<Time><![CDATA[5/11/2021 - 15:13:30]]></Time>
<TimeTick>1620742410</TimeTick>
<NodeArgs eType="User" icon="10" nRep="101" status="Passed" >
<Disp><![CDATA[Back_2 button not displayed]]></Disp>
</NodeArgs>
</Step>
<Step rID="T65">
<Obj plainTxt="False" ><![CDATA[Oracle Retail Xstore Point]]></Obj>
<Details plainTxt="False" ><![CDATA[JavaWindow]]></Details>
<Time><![CDATA[5/11/2021 - 15:13:32]]></Time>
<TimeTick>1620742412</TimeTick>
<Step rID="T66">
<Obj plainTxt="False" ><![CDATA[Yes.Exist]]></Obj>
<Details plainTxt="False" ><![CDATA["Object does not exist"]]></Details>
<Time><![CDATA[5/11/2021 - 15:13:32]]></Time>
<TimeTick>1620742412</TimeTick>
<NodeArgs eType="Replay" icon="7" nRep="104" >
<Disp><![CDATA[Yes.Exist]]></Disp>
</NodeArgs>
</Step>
<Step rID="T67">
<Obj plainTxt="False" ><![CDATA[[ JavaEdit ].Exist]]></Obj>
<Details plainTxt="False" ><![CDATA["Object does not exist"]]></Details>
<Time><![CDATA[5/11/2021 - 15:13:33]]></Time>
<TimeTick>1620742413</TimeTick>
<NodeArgs eType="Replay" icon="8" nRep="106" >
<Disp><![CDATA[[ JavaEdit ].Exist]]></Disp>
</NodeArgs>
</Step>
<Step rID="T68">
<Obj plainTxt="False" ><![CDATA[Back_2.Exist]]></Obj>
<Details plainTxt="False" ><![CDATA["Object exists"]]></Details>
<Time><![CDATA[5/11/2021 - 15:13:33]]></Time>
<TimeTick>1620742413</TimeTick>
<NodeArgs eType="Replay" icon="7" nRep="107" >
<Disp><![CDATA[Back_2.Exist]]></Disp>
</NodeArgs>
</Step>
<NodeArgs eType="Context" icon="6" nRep="103" >
<Disp><![CDATA[Oracle Retail Xstore Point]]></Disp>
</NodeArgs>
</Step>
<Step rID="T69">
<Obj ><![CDATA[Back_2 button not displayed]]></Obj>
<Details ><![CDATA[Button not displayed]]></Details>
<Time><![CDATA[5/11/2021 - 15:13:33]]></Time>
<TimeTick>1620742413</TimeTick>
<NodeArgs eType="User" icon="10" nRep="108" status="Passed" >
<Disp><![CDATA[Back_2 button not displayed]]></Disp>
</NodeArgs>
</Step>
<Step rID="T70">
<Obj plainTxt="False" ><![CDATA[Oracle Retail Xstore Point]]></Obj>
<Details plainTxt="False" ><![CDATA[JavaWindow]]></Details>
<Time><![CDATA[5/11/2021 - 15:13:36]]></Time>
<TimeTick>1620742416</TimeTick>
<Step rID="T71">
<Obj plainTxt="False" ><![CDATA[Yes.Exist]]></Obj>
<Details plainTxt="False" ><![CDATA["Object does not exist"]]></Details>
<Time><![CDATA[5/11/2021 - 15:13:36]]></Time>
<TimeTick>1620742416</TimeTick>
<NodeArgs eType="Replay" icon="7" nRep="111" >
<Disp><![CDATA[Yes.Exist]]></Disp>
</NodeArgs>
</Step>
<Step rID="T72">
<Obj plainTxt="False" ><![CDATA[[ JavaEdit ].Exist]]></Obj>
<Details plainTxt="False" ><![CDATA["Object does not exist"]]></Details>
<Time><![CDATA[5/11/2021 - 15:13:37]]></Time>
<TimeTick>1620742417</TimeTick>
<NodeArgs eType="Replay" icon="8" nRep="113" >
<Disp><![CDATA[[ JavaEdit ].Exist]]></Disp>
</NodeArgs>
</Step>
<Step rID="T73">
<Obj plainTxt="False" ><![CDATA[Back_2.Exist]]></Obj>
<Details plainTxt="False" ><![CDATA["Object exists"]]></Details>
<Time><![CDATA[5/11/2021 - 15:13:37]]></Time>
<TimeTick>1620742417</TimeTick>
<NodeArgs eType="Replay" icon="7" nRep="114" >
<Disp><![CDATA[Back_2.Exist]]></Disp>
</NodeArgs>
</Step>
<NodeArgs eType="Context" icon="6" nRep="110" >
<Disp><![CDATA[Oracle Retail Xstore Point]]></Disp>
</NodeArgs>
</Step>
<Step rID="T74">
<Obj ><![CDATA[Back_2 button not displayed]]></Obj>
<Details ><![CDATA[Button not displayed]]></Details>
<Time><![CDATA[5/11/2021 - 15:13:37]]></Time>
<TimeTick>1620742417</TimeTick>
<NodeArgs eType="User" icon="10" nRep="115" status="Passed" >
<Disp><![CDATA[Back_2 button not displayed]]></Disp>
</NodeArgs>
</Step>
<Step rID="T75">
<Obj plainTxt="False" ><![CDATA[Oracle Retail Xstore Point]]></Obj>
<Details plainTxt="False" ><![CDATA[JavaWindow]]></Details>
<Time><![CDATA[5/11/2021 - 15:13:39]]></Time>
<TimeTick>1620742419</TimeTick>
<Step rID="T76">
<Obj plainTxt="False" ><![CDATA[Yes.Exist]]></Obj>
<Details plainTxt="False" ><![CDATA["Object does not exist"]]></Details>
<Time><![CDATA[5/11/2021 - 15:13:39]]></Time>
<TimeTick>1620742419</TimeTick>
<NodeArgs eType="Replay" icon="7" nRep="118" >
<Disp><![CDATA[Yes.Exist]]></Disp>
</NodeArgs>
</Step>
<Step rID="T77">
<Obj plainTxt="False" ><![CDATA[[ JavaEdit ].Exist]]></Obj>
<Details plainTxt="False" ><![CDATA["Object does not exist"]]></Details>
<Time><![CDATA[5/11/2021 - 15:13:40]]></Time>
<TimeTick>1620742420</TimeTick>
<NodeArgs eType="Replay" icon="8" nRep="120" >
<Disp><![CDATA[[ JavaEdit ].Exist]]></Disp>
</NodeArgs>
</Step>
<Step rID="T78">
<Obj plainTxt="False" ><![CDATA[Back_2.Exist]]></Obj>
<Details plainTxt="False" ><![CDATA["Object exists"]]></Details>
<Time><![CDATA[5/11/2021 - 15:13:40]]></Time>
<TimeTick>1620742420</TimeTick>
<NodeArgs eType="Replay" icon="7" nRep="121" >
<Disp><![CDATA[Back_2.Exist]]></Disp>